{
  "apiVersion": "evolith.dev/topology/v1",
  "kind": "TopologyManifest",
  "metadata": {
    "id": "data-mesh",
    "name": "Data Mesh",
    "dimension": "data",
    "status": "accepted",
    "version": "1.0.0",
    "governance": {
      "owner": "Data Architecture",
      "criticality": "P1"
    }
  },
  "spec": {
    "summary": "Distributed analytical data ownership topology for governed data products, discoverable contracts, quality evidence, and domain-aligned interoperability.",
    "topologyType": "data-mesh",
    "compatibility": {
      "progressiveAxis": {
        "maturityLevel": "cross",
        "profile": "cross"
      },
      "composableWith": [
        "distributed-modules",
        "microservices",
        "event-driven",
        "serverless",
        "agentic-ai"
      ]
    },
    "artifacts": {
      "adrs": [
        "reference/architecture/adrs/core/0084-data-mesh-data-products.md",
        "reference/architecture/adrs/core/0079-multi-topology-reference-corpus.md"
      ],
      "rulesets": [
        "rulesets/topologies/data-mesh/data-mesh.rules.json"
      ],
      "opaPolicies": [
        "rulesets/topologies/data-mesh/data-mesh.rego"
      ],
      "aiRulesets": [
        "rulesets/topologies/data-mesh/README.md"
      ],
      "umsContracts": [
        "reference/knowledge/demo/ums-reference-model.md"
      ]
    },
    "corpus": {
      "guidance": {
        "profile": "rulesets/topologies/data-mesh/README.md",
        "maturityGuide": "rulesets/topologies/data-mesh/maturity.md"
      },
      "configurationContract": "rulesets/topologies/data-mesh/topology.config.schema.json",
      "fixtures": {
        "valid": "rulesets/topologies/data-mesh/fixtures/valid.topology.config.json",
        "invalid": "rulesets/topologies/data-mesh/fixtures/invalid.topology.config.json"
      },
      "nativeEvaluator": "packages/core-domain/src/application/validators/ruleset-validator.service.ts",
      "tests": {
        "positive": "packages/core-domain/src/application/validators/ruleset-validator-architecture.spec.ts",
        "negative": "packages/core-domain/src/application/validators/ruleset-validator-architecture.spec.ts"
      },
      "evidence": "reference/governance/standards/vision/maturity-evidence.json"
    },
    "operationalInterfaces": {
      "cli": {
        "validators": [
          "validate-architecture",
          "validate-topology"
        ]
      },
      "mcp": {
        "resources": [
          "evolith://topologies/data-mesh/manifest",
          "evolith://topologies/data-mesh/rulesets"
        ],
        "tools": [
          "evolith-topology-inspect",
          "evolith-topology-validate"
        ],
        "prompts": [
          "topology-aware-implementation"
        ]
      },
      "coreApi": {
        "endpoints": [
          "GET /topologies/{id}",
          "GET /topologies/{id}/manifest",
          "POST /topologies/{id}/validate"
        ]
      }
    }
  },
  "businessBoundary": {
    "technicalOnly": true,
    "trackerOwns": [
      "timing",
      "ownership",
      "prioritization",
      "roi",
      "cost",
      "budget",
      "funnel-0"
    ]
  }
}
